[
  {
    "round_id": 1,
    "timestamp": "2026-06-29T10:30:00Z",
    "configs": [
      {
        "config_id": "config-001",
        "params": {
          "learning_rate": 0.001,
          "batch_size": 16,
          "weight_decay": 0.0001,
          "dropout": 0.3
        },
        "metrics": {
          "dice_lv": 0.82,
          "dice_rv": 0.79,
          "dice_myo": 0.71,
          "dice_overall": 0.77,
          "loss": 0.18
        },
        "train_loss": 0.15,
        "val_loss": 0.18,
        "status": "completed",
        "duration_min": 45,
        "gpu_memory_gb": 6.2,
        "seed": 42,
        "commit_hash": "a1b2c3d",
        "error_type": null
      },
      {
        "config_id": "config-002",
        "params": {
          "learning_rate": 0.0005,
          "batch_size": 16,
          "weight_decay": 0.0001,
          "dropout": 0.3
        },
        "metrics": {
          "dice_lv": 0.85,
          "dice_rv": 0.83,
          "dice_myo": 0.76,
          "dice_overall": 0.81,
          "loss": 0.15
        },
        "train_loss": 0.12,
        "val_loss": 0.15,
        "status": "completed",
        "duration_min": 47,
        "gpu_memory_gb": 6.1,
        "seed": 43,
        "commit_hash": "a1b2c3d",
        "error_type": null
      },
      {
        "config_id": "config-003",
        "params": {
          "learning_rate": 0.01,
          "batch_size": 32,
          "weight_decay": 0.001,
          "dropout": 0.5
        },
        "metrics": {
          "dice_lv": 0.65,
          "dice_rv": 0.58,
          "dice_myo": 0.52,
          "dice_overall": 0.58,
          "loss": 0.35
        },
        "train_loss": 0.32,
        "val_loss": 0.35,
        "status": "completed",
        "duration_min": 82,
        "gpu_memory_gb": 11.4,
        "seed": 44,
        "commit_hash": "a1b2c3d",
        "error_type": null
      },
      {
        "config_id": "config-004",
        "params": {
          "learning_rate": 0.0005,
          "batch_size": 32,
          "weight_decay": 0.01,
          "dropout": 0.3
        },
        "metrics": {
          "dice_lv": 0.73,
          "dice_rv": 0.71,
          "dice_myo": 0.65,
          "dice_overall": 0.70,
          "loss": 0.22
        },
        "train_loss": 0.09,
        "val_loss": 0.22,
        "status": "completed",
        "duration_min": 80,
        "gpu_memory_gb": 11.2,
        "seed": 45,
        "commit_hash": "a1b2c3d",
        "error_type": null
      },
      {
        "config_id": "config-005",
        "params": {
          "learning_rate": 0.0001,
          "batch_size": 8,
          "weight_decay": 0.0001,
          "dropout": 0.2
        },
        "metrics": {
          "dice_lv": 0.78,
          "dice_rv": 0.74,
          "dice_myo": 0.68,
          "dice_overall": 0.73,
          "loss": 0.20
        },
        "train_loss": 0.18,
        "val_loss": 0.20,
        "status": "completed",
        "duration_min": 30,
        "gpu_memory_gb": 3.8,
        "seed": 46,
        "commit_hash": "a1b2c3d",
        "error_type": null
      }
    ],
    "best_config_id": "config-002",
    "resource_usage": {
      "parallel_count": 5,
      "gpu_utilization": "76%"
    }
  },
  {
    "round_id": 2,
    "timestamp": "2026-06-29T12:15:00Z",
    "configs": [
      {
        "config_id": "config-006",
        "params": {
          "learning_rate": 0.0005,
          "batch_size": 16,
          "weight_decay": 0.0005,
          "dropout": 0.2
        },
        "metrics": {
          "dice_lv": 0.87,
          "dice_rv": 0.85,
          "dice_myo": 0.78,
          "dice_overall": 0.83,
          "loss": 0.13
        },
        "train_loss": 0.10,
        "val_loss": 0.13,
        "status": "completed",
        "duration_min": 46,
        "gpu_memory_gb": 6.1,
        "seed": 47,
        "commit_hash": "a1b2c3d",
        "error_type": null
      },
      {
        "config_id": "config-007",
        "params": {
          "learning_rate": 0.0003,
          "batch_size": 16,
          "weight_decay": 0.0001,
          "dropout": 0.3
        },
        "metrics": {
          "dice_lv": 0.86,
          "dice_rv": 0.84,
          "dice_myo": 0.77,
          "dice_overall": 0.82,
          "loss": 0.14
        },
        "train_loss": 0.11,
        "val_loss": 0.14,
        "status": "completed",
        "duration_min": 45,
        "gpu_memory_gb": 6.2,
        "seed": 48,
        "commit_hash": "a1b2c3d",
        "error_type": null
      },
      {
        "config_id": "config-008",
        "params": {
          "learning_rate": 0.001,
          "batch_size": 32,
          "weight_decay": 0.001,
          "dropout": 0.5
        },
        "metrics": {
          "dice_lv": 0.68,
          "dice_rv": 0.62,
          "dice_myo": 0.55,
          "dice_overall": 0.62,
          "loss": 0.31
        },
        "train_loss": 0.28,
        "val_loss": 0.31,
        "status": "pruned",
        "duration_min": 12,
        "gpu_memory_gb": 11.0,
        "seed": 49,
        "commit_hash": "a1b2c3d",
        "error_type": null
      }
    ],
    "best_config_id": "config-006",
    "resource_usage": {
      "parallel_count": 3,
      "gpu_utilization": "71%"
    }
  }
]
