[
  {
    "round_id": 1,
    "timestamp": "2026-06-29T10:00:00Z",
    "configs": [
      {
        "config_id": "config-001",
        "params": {"C": 1.0, "gamma": 0.1, "kernel": "rbf"},
        "metrics": {"accuracy": 0.85, "f1": 0.84},
        "train_loss": null,
        "val_loss": null,
        "status": "completed",
        "duration_min": 2,
        "gpu_memory_gb": null,
        "seed": 42,
        "commit_hash": null,
        "error_type": null,
        "attempt": 1,
        "retry_of": null
      },
      {
        "config_id": "config-002",
        "params": {"C": 10.0, "gamma": 0.01, "kernel": "rbf"},
        "metrics": {"accuracy": 0.88, "f1": 0.87},
        "train_loss": null,
        "val_loss": null,
        "status": "completed",
        "duration_min": 3,
        "gpu_memory_gb": null,
        "seed": 43,
        "commit_hash": null,
        "error_type": null,
        "attempt": 1,
        "retry_of": null
      }
    ],
    "best_config_id": "config-002",
    "resource_usage": {"parallel_count": 4, "gpu_utilization": null}
  }
]
